neighborhood,description,history,vibe,activities_attractions
greenwood,"Greenwood has risen from the bog of its past (literally!) to become a busy, family-friendly, affordable neighborhood.","Humbler beginnings are hard to come by. In its early days, Greenwood (then called Woodland) was known for its wet, marshy landscape and, frankly, its cemetery. As demand for land grew and the trolley lines made their way north, the cemetery was transplanted to Crown Hill and the building began. By the 1940’s, Greenwood Avenue was known as the “Miracle Mile” because of its plethora of shops, pharmacies, banks, restaurants, and even a department store. The bog threatened to swallow up some of the lower houses, but the annexation of Greenwood into the city of Seattle provided much needed infrastructure changes that kept the neighborhood from sinking back from whence it came.","Today, Greenwood’s business district remains as successful as it was decades ago. The area around 85th Street and Greenwood Avenue is booming with coffeehouses, antique stores, bars, and eateries, along with a community theater. The community hosts many events that appeal to families and urbanites alike. Things tend to quiet down at night, which makes this the perfect place to live if you like to be on the move during the day and a homebody when the sun goes down.","Let’s start with the major events that Greenwood hosts every year. There’s the Greenwood Car Show every June, and the beloved Seafair parade in August—complete with the Seafair Pirates and a synchronized motorcycle routine by the local police force. Monthly art walks showcase not only local artists, but give you a chance to tour all of the interesting businesses along Greenwood Avenue.The Taproot Theatre is still going strong despite being damaged in a fire in 2009. One of the largest mid-size theatre companies in Seattle, their mission is to “create theatre that explores the beauty and questions of life while providing hope to our search for meaning.” They accomplish this by putting on plays on their main stage, offering classes to budding actors of all ages, and by traveling to schools and clubs to perform on the road. They even have their own café now!Other worthy stops include the Greenwood library, newly renovated and a pleasant space, Top Ten Toys, one of the coolest toy stores in the city, and Green Bean Coffeehouse, which devotes equal time to making a great community as it does making a great latte. Try Mr. Gyros for a pita wrapped around something amazing, or go to Naked City Taphouse for a cold brew and yummy dinner. The latest hot spot is Chuck’s Hop Shop – proudly deemed “The Land of a Thousand Beers”. It also features a rotating schedule of daily food trucks – making it the perfect spot for a quick bite and a beer! And if you have a sweet tooth, the case of homemade truffles at Chocolati Café is sure to make your cavities ache for more."
haller-lake,"It’s hard to believe that a tiny lake could have an entire neighborhood named after it, but that’s a testament to the special feel of the private little waterfront and surrounding area.","Let’s call Haller Lake a ‘late bloomer’ of a neighborhood. No one really settled in the area until the mid-1900s; with the many other smaller neighborhoods nearer to downtown, there was no reason to. The majoring of households were on large plots of land with enough room far farm animals and orchards. The small lake, originally owned by John Welch and then bought by Theodore Haller, was the most desirable place to settle.A woman named Clare Huntoon saw potential, however, and purchased a bunch of land. Nothing much became of it as far as housing is concerned, but her land is now home to major businesses and community centers, ranging from Ingraham High School and Helene Madison pool to Northwest Hospital and the Evergreen-Washelli cemetery.Residents of the community have long resisted expansion and population growth due to their love of the environment and their disdain for traffic congestion.","The atmosphere in Haller Lake varies widely depending on where you are in the neighborhood. On its edges, near Aurora Avenue to the west and Northgate Way to the south, are the business districts (and the traffic we mentioned before). As you head towards the center, the activity fades and quiet residential streets take over. With larger plots of land than other places in the city, residents can spread out a little and enjoy the quiet.","Haller Lake itself has a ‘secret garden’ kind of feel; only one road lends public access, and the four or so parking spaces only further the sensation that you’ve stumbled across something private. The water has that glassy quality from being sheltered from wind and watercraft, and the small shore is perfect for a picnic or just sunbathing.Nearby Northacres Park is perfect for letting the dog out for some off-leash time on the woodsy trails, or bringing the kids for some wading pool action.Haller Lake also offers the only granite curling facility in the area. Grab a broom, join a team, or sign up for some practice time at one of their monthly open houses to try your hand at that newly-famous sport!"
loyal-heights,Nestled in the middle of Ballard is the Loyal Heights residential area. Poking around among the adorable homes here makes it easy to see why residents here would be loyal to their sweet neighborhood.,"Loyal Heights was first considered a suburb of the city of Ballard, before it was annexed into Seattle. It includes the area north of 65th and west of 15th Avenue, extending to Puget Sound, though sometimes the western part is referred to as Sunset Hill. The man who first developed the area had a daughter named Loyal. He must have loved her a lot, because he not only named the neighborhood after her, but also Loyal Beach and the local trolley line. (As a side note, you have to wonder how is other daughter, Priscilla, felt about all of that!)Nearly all of the residences here are homes that were built before the 1960s, which only adds to the old-school charm of this neighborhood.","Life seems to slow down when you enter Loyal Heights. Away from the organized chaos of Ballard, it’s easy to relax and enjoy the view of Puget Sound and the Olympic Mountains. Yet, because of its location, you don’t feel disconnected from the city, either. The area around 15th Avenue is the busiest, and as you head west and down toward the water, things get more and more calm.","Along the main streets of 15th Avenue and 80th Street, there are many places unique to Loyal Heights. Around the intersection of 80th and 24th, Larsen’s Bakery is famous citywide for its traditional Danish Kringle, and the nearby Fresh Fish Company and Italian Meat Market can help round out your meal planning for the week.If you’re looking for something a little more out-of-the-ordinary, why not stop by Zen Dog Studio & Tea House Gallery, where you can meet the owner (aka Zen Dog), sip tea, and view the Asian artwork collection? Or sign up for a class at Pole for the Soul where you can channel your inner pole-dancer."
magnolia,"There’s a lot going on in this neighborhood: waterways, railways, golf course, military fort, beaches, and tremendous views all the way ‘round.","In its early days, Magnolia wasn’t a very popular place. The land wasn’t great for farming and it was hard to get to, being a peninsula and all. One very smart man, however, saw potential. “Hmm,” Dr. Henry Smith probably said to himself, “Here we’ve got this great downtown area, some low-lying land perfect for a rail line, and nearby a nice little cove. I’m gonna buy me that cove and make a killing in the shipping industry!” And that is what he did, though it took 40 years before the train actually got there. Magnolia became a major trade post, bringing goods in from across the Pacific. (Today, Smith Cove is a cruise ship terminal, which is equally important!)It didn’t take long before the roads improved, and people could settle in the hills of Magnolia. The military built Fort Lawton on the northwest section of the peninsula. At its prime 20,000 soldiers were stationed here, but after the Vietnam war, 85% of the land was sold to the city. Discovery Park was created, giving us the biggest park in the entire city.","Because it’s on a peninsula, Magnolia has a secluded feel. Looking at the neighborhood from outside, you might think there isn’t much more there than houses and a marina. Wrong! The area around McGraw Street and 34th Avenue W is a little pocket of activity, with aWalk Scorerivaling that of Fremont or Greenlake. A glance at the neighborhood’s blogshows that there’s always something going on here, be it a farmer’s market, the yearly SummerFest celebration, a free nature walk at Discovery Park, or a spur-of-the-moment community outreach event.Not to be left out is Fisherman’s Terminal, located right on Salmon Bay near the 15th Street Bridge. Here, you can walk around on the docks and admire the real-life fishing boats, then stop in at the market tobuy the seafood caught that very day. Though not as famous as the Pike Place Market, rumor has it that this is an even better way to experience the local fishing culture.","Discovery Park is one of the biggest lures that Magnolia offers. Its offerings run the gamut from hiking trails to tide pools, with streams, meadows, and sandy beaches in between. The greatest part of the park is their dedication to nature education; throughout the year you can attend classes to learn about the flora and fauna native to the region—bird watching and low tide walks are some of the most popular. Also located in Discovery Park is the Daylight Star, a Native American cultural center complete with conference center, facilities for pow wows, and an art gallery.If you prefer the neighborhoody over the outdoorsy, try visiting the cluster of blocks around McGraw Street and 34th Avenue West. It’s something you have to stumble across, but once you’re there you’ll be set for the day. In the summer, this is the spot of the Saturday farmer’s market. Or come through any day or season and visit the plentiful cafes, salons, boutiques and bakeries. Food options include Hawaiian, Mexican, sushi, Italian, sandwiches, Thai, pub grub…anything! The community pool and library are also big hits with the kids."
blue-ridge-north-beach,"With expansive views of Puget Sound, one of Seattle’s best parks—Carkeek—in its back yard, and beautiful homes that were almost all built within twenty years of each other, the Blue Ridge neighborhood of north Seattle has plenty to offer. Just south of Blue Ridge and bordering another stunner of a park, Golden Gardens, North Beach is a little less formal than Blue Ridge, but has similar homes and views. The two neighborhoods are often lumped together as the Blue Ridge/North Beach neighborhood.","After he tired of building airplanes, William Boeing decided to dip his toe into the land development market. He bought up a large chunk of land in northwest Seattle and began the Blue Ridge project. Trees were cleared, houses were built, and the wealthy of Seattle moved in. Five of the first homes, which were occupied by Boeing executives, still stand today and are referred to by residents as “the castles.”","Though years have passed and new types of people have moved in, Blue Ridge has kept its reputation as an elite community. A fancy community club, pristine landscaping, and streets that have a private-access kind of feel further cement this notion.","Being a residential neighborhood, Blue Ridge doesn’t have a business district or many destinations to check out. Except, of course, for Carkeek Park. Over 400 homes back up to the ravine that has trees, hiking trails, and picturesque streams and bridges. The park also has beach access, an environmental learning center, and picnic and playground areas where the infamous Bubble Man is known to dropinto entertain the kiddies. You can also head down to Golden Gardens Park for an excellent beach, off-leash dog area or an evening bonfire.Swanson’s Nursery is another gem situated in the neighborhood. Any home gardener would be happy to spend hours exploring their selection of plants, both native and exotic. It’s also a favorite spot to visit in December with Santa visits, elaborate Christmas displays, electric train, and of course a chance to get your fresh-cut Christmas tree!"
phinney-ridge,The Ridge that runs across the hilltop separating Ballard and Green Lake is enjoying a surge of new family friendly stops along the bustling Phinney / Greenwood Avenues. This ‘hood offers the ultimate in playgrounds – the Woodland Park Zoo.,"One of the earliest residents west of Green Lake was the wealthy Guy Phinney, who had his own private estate on the crest of the hill (which would later become Woodland Park and the Zoo). As the area immediately surrounding Green Lake filled with residents and the sawmill there worked its way through the nearby trees, people took advantage of the newly cleared land and moved in. Mr. Phinney encouraged more settlers by putting in his own trolley from Fremont to the area. As more transportation lines were put in, the entire area, including Phinney and Greenwood, became increasingly popular.","This area is the perfect mix of quiet neighborhood meets in-city energy. Phinney Avenue just begs to be strolled down and enjoyed. New eateries, coffee shops, and fun boutique shops are opening up all the time, and the Phinney Neighborhood Association keeps a steady string of community events on their calendar.","People from all over the city flock to Woodland Park and Woodland Park Zoo. Rumor has it, if you live on the edge of the park, you get two free passes to the summer ZooTunes concerts! Red Mill Burgers is a must-see, as is the PhinneyWood Art Walk. There also seem to be a high number of pet-related businesses; pets are welcome here!Of course, Green Lake is just a roll down the hill to the east, and Ballard is equally close to the west."
queen-anne,"If its name isn’t enough indication, the fact that this neighborhood can really be divided into four smaller ones should give you a clue as to how fancy and important it is.","Originally called Eden Hill, this neighborhood was one of the last to be completely developed because, well, it’s steep. As you can imagine, the base was the first to be built upon, but nobody really wanted to deal with trekking up to its top to build a home. In fact, land developers tried a “two-for-one” deal, where you could get two plots of land for the price of one if you built a house immediately. Can you imagine something like that happening today?! Once the issue of roads and transportation was solved, however, the area quickly populated. Sadly, no queen ever lived here. So many built Queen Anne style houses, the entire neighborhood adopted the name.","Well, it depends where you are on the Hill. Lower Queen Anne backs up to the Seattle Center (which includes the Space Needle, Key Arena, Science Center, etc.) and is close to all that downtown has to offer. East and West Queen Anne, which meet in the middle at the top of the hill, are both great residential areas that share a common business district along Queen Anne Avenue. North Queen Anne, which faces Fremont, is home to Seattle Pacific University and has a quieter feel.","Depending on who you ask, Lower Queen Anne may or may not include the Seattle Center, but let’s pretend for a moment that it does. In that case, there are about a gazillion events and attractions to keep you busy—Bumbershoot, Folk Life, IMAX theater, Children’s Theater, Key Arena (Rat City Rollergirls,or Seattle Stormanyone?), the Bite of Seattle, etc. etc. etc. Even if you eliminate that area, there are still tons of cool local restaurants and bars: Uptown Espresso, Ozzie’s Karaoke Bar, Peso’s, and Buckley’s sports-themed bar. Don’t even get me started!If this neighborhood had a central nervous system, Queen Anne Avenue would be the spinal cord; it runs straight through the middle and is where most of the important stuff happens. Up at the top of the hill, there are about 10 blocks’ worth of unique and charming places to peruse. Though there are great places to nosh—El Diablo (ask for your latte Cuban-style, with caramelized sugar), the famous How to Cook a Wolf, or the down-home 5 Spot with their rotating menu—there are many other things to do! Check out the stellar view of downtown Seattle and Mount Rainier from Kerry Park. Or relax and play a board game before you buy it at Blue Highway Games, where the motto is “Unplug and Reconnect.” Love it!"
wallingford,"If you’re like me, the word “Wallingford” brings to mind a snobbish million-dollar estate in England somewhere.  Well, forget it! The Seattle version of Wallingford is definitely not snobbish, nor will it cost you millions of dollars. But English accents are welcome.The neighborhood takes its name from a rich landowner who possessed almost the entire area from Green Lake down to Lake Union. It was annexed into the city in the 1890’s and began to grow once a trolley was built to connect downtown with Green Lake.","In 1906, a large industrial area was developed where coal was turned into gas–the area now known as Gasworks Park. Despite the fact that it spewed ash and sparks everywhere, the neighborhood continued to grow, attracting schools, businesses, and homes. By 1920, Wallingford was known as one of the more popular and fastest-growing spots in Seattle.","Wallingford has a nice mix of down-home, been-here-forever places (Dick’s Burgers and the Durn Good Grocery, for example) and trendy, hot-for-fall places, like Molly Moon ice cream and Tilth. The busiest area is along 45th Street, which is always bustling with activity as people visit the ever-changing lineup of restaurants, bars, and shops. Farther from the action lies the residential area with some pretty cool old homes.","As we mentioned earlier, there is tons to do along 45th Street. The Guild Theater, a two-screen cinema originally built in 1919, is still a popular attraction for moviegoers. Before the show, try out the Wallingford Pizza House for one of their famous “dome” pizzas–you have to see it to understand it. Afterwards, pop into Murphy’s Pub for a nightcap.The Wallingford Center, an old school building that was recently renovated to house apartments and retail spaces, is a big attraction. Year-round, head inside for a look-see around all of the gift shops, and make sure you grab a Trophy cupcake while you’re there!Gasworks Park is also a major landmark in the area. Learn a bit of history while touring the old plant, or maybe try your hand at kite-flying at the top of the hill. This is also a perfect place to hang out on the 4th of July, where you can picnic and watch the fireworks.Of course you can’t talk about Wallingford without giving a nod to that iconic QFC sign. They recently remodeled the building, but kept the sign. A good thing, too–otherwise The People may have revolted."
westlake,"The narrow strip of land along the western shore of Lake Union is aptly named Westlake, much like it’s brother to the east, Eastlake. Westlake is a major transportation corridor between downtown and North Seattle, filled with a mix of condos, apartments, offices, homes and houseboats.","The history of Westlake is inexorably linked to the growth of Seattle’s coal and timber industries along Lake Union. Transporting coal from Renton and Newcastle to ships on Elliott Bay eventually lead to construction of Seattle’s first railway along what is now Westlake Ave. A large lumber mill at the south end of Lake Union also fueled the need for transport along the lake. The Seattle Electric Railway extended its line to Fremont over a planked trestle hugging the western shore of Lake Union. That route still exists today as Westlake Ave, which was paved in 1906.","Westlake is a very narrow sliver of a neighborhood, sandwiched between Aurora Ave and Lake Union. Three major arterial roads cut through the neighborhood as the main routes from downtown to neighborhoods like Fremont, Ballard and Wallingford. Transport to and from downtown is easy, either via bus, car or bicycle.Westlake does house quite a few folks in a hodge-podge of accommodations. There are still 100 yr homes mixed in with more modern apartments and condos and even some townhomes. Like Eastlake, Westlake also houses a significant enclave of houseboat dwellers along the northwest shore of Lake Union.Despite its small size, Westlake is fairly crowded, with parking sometimes difficult on its crowded, narrow streets. It is also the land of urban condo/apartment dwellers with very few kids. There are also quite a few office buildings in this area, including some of Seattle’s most unique offices with parking spots for your boat underneath!","Westlake is home to a number of major attractions. The new South Lake Union Park is a great place to enjoy on a nice day, and from there it is a short hop to Kenmore Air and Argosy Cruises. You can also rent an electric boat or hot tub boat. The first Sunday of the month brings the infamous pancake breakfast at the Swedish Cultural Center.Lake Union has always been heavy with commercial activity. The lumber and coal transport along Westlake Ave has been changed to marinas, boat maintenance and yacht brokers. If you are looking to pilfer your retirement savings for a boat, you’ll likely end up at an establishment along Westlake.While Westlake is very urban and convenient, it doesn’t have much in the way of restaurants or stores of its own. It is convenient to the hotspots in Fremont, Queen Anne, Eastlake and South Lake Union, however."
whittier-heights,This small residential section of Ballard is ideal for people who love the vibe of northwest Seattle but want a slightly quieter place to call home.,"Much like other nearby subdivisions like Loyal Heights and Sunset Hill, Whittier Heights was only moved into once the housing options in downtown Ballard had filled up. The biggest era for growth was 1920 through 1940, when most of the houses were built. In more recent years, some new homes have been built, leaving the neighborhood with a nice mix of the vintage and the modern.","Whittier Heights is an unassuming residential neighborhood, basking quietly in the glow of its bigger sister, Ballard. The streets here are in a straightforward grid pattern, which furthers the notion that it’s a no-frills, no-nonsense place to live. On the outer edges of the neighborhood there are some fun pockets of businesses that offer nice alternatives to the main drag in Ballard.","One of the most charming places to explore in Whittier Heights is the area along 65th street at its southern border. This mini business district has a surprising variety of establishments, from dive bars like The Tin Hat to shoe shops (The Sneakery). Word has it that The Dray is a great place to watch soccer (I mean ‘football’) and sample some obscure beers. You can also get a tattoo at Slave to the Needle or check out Babalouise, the local salon.Further into the ‘heart’ of Whittier are a few other gems. People are raving about Honore Bakery and their French-inspired goods. Delancey pizza also deserves a nod for its wood-fired and unique pies. Just get ready to wait in line at both of these places!"
beacon-hill,"The giant tract of land south of downtown between I-5 and Rainier Valley is known as Beacon Hill, easy to find because of the old veteran’s hospital that sits atop its peak. Despite its close proximity to downtown and First Hill, Beacon Hill has a vibe all its own.","The key to Beacon Hill is its seclusion from the surrounding areas. This was a problem at first; no one was willing to move to the hill that was just slightly too far away. Eventually the hill was re-graded, making the area more accessible. When a trolley line was finally put in, many immigrants flocked to the neighborhood to farm and sell their produce to others.In 1909, a jail was built and inmates could “work off” part of their sentence by helping to clear the land for Jefferson park. And when the US Army warplanes came to Seattle in 1918, they had no airport at which to land, so they used this very park as their runway. This prompted the city to build Boeing field at the base of Beacon Hill.","Depending upon where you are on Beacon Hill, you’ll get a different feel for the neighborhood. The busiest section is on the north end, especially whereBeacon Hill meets the Rainier Valley. Up at the top of the hill, things settle down into a nice residential area with a small business district. The farther south you go, the more secluded and quiet things get.","Though Beacon Hill is largely residential, there are several pockets of activity in different areas. Beacon Avenue runs the length of the hill, and if you travel from north to south, you’ll get a great view of downtown and then reach a small area with restaurants and stores near 15th Avenue. Stop at The Station for coffee, or Delite Bakery—one of the favorite spots for residents here. If you keep heading south, you’ll go through Jefferson Park, which has a golf course, hiking trails, tennis courts, and kid-friendly play equipment.Along Rainier Avenue on the east side of the hill, there is an abundance of places to check out. Go bowling at Imperial Lanes or grab food at one of the many ethnic restaurants that line the street."
